{
  "schema_version": "1.0.0",
  "metadata": {
    "project_name": "Restricted router fixture",
    "repository": "verified-code-security-audit/evaluations/fixtures/restricted-router",
    "revision": "48e704658ecfef5ad3b2d74bdbb09fd0a8fc98d7",
    "branch": "main",
    "audited_at": "2026-09-05T13:46:04.1799784-03:00",
    "worktree_dirty": true,
    "content_locale": "en"
  },
  "scope": {
    "summary": "Static review of the complete declared three-route inventory and the two available handlers. No verified findings in the reviewed scope under the assumption of a trusted authenticated principal. Review is partial: the export handler is withheld, and authentication, dispatch, and object loading are outside scope. Neither all-routes-reviewed nor a system-wide no-IDOR conclusion is supported.",
    "included_paths": ["routes.json", "handlers.py"],
    "excluded_paths": [
      {"path": "restricted.py", "reason": "Export implementation is withheld and absent from this fixture; searching other directories is prohibited."}
    ]
  },
  "stack": [
    {
      "kind": "language",
      "name": "Python handlers; runtime version unspecified",
      "evidence": [{"path": "handlers.py", "start_line": 4, "end_line": 7, "snippet": "def own_invoice(principal, invoice):\n    if invoice[\"tenant_id\"] != principal[\"tenant_id\"]:\n        raise PermissionError(\"forbidden\")\n    return invoice"}]
    },
    {
      "kind": "routing",
      "name": "JSON declaration of HTTP GET routes; dispatch framework unspecified",
      "evidence": [{"path": "routes.json", "start_line": 2, "end_line": 4, "snippet": "  \"GET /own-invoice/{id}\": \"handlers.py:own_invoice\",\n  \"GET /admin/summary\": \"handlers.py:admin_summary\",\n  \"GET /exports/{id}\": \"restricted.py:export\""}]
    }
  ],
  "coverage": [
    {
      "surface": "api-routes",
      "status": "limited",
      "discovered": 3,
      "reviewed": 2,
      "method": "Enumerated every entry in the scenario-designated complete routes.json manifest. Statically traced both available handler bodies.",
      "exclusions": ["GET /exports/{id}: restricted.py:export is withheld.", "Authentication and route dispatch implementations are outside scope; handler review does not verify deployed route reachability."]
    },
    {
      "surface": "object-identifier-routes",
      "status": "limited",
      "discovered": 2,
      "reviewed": 1,
      "method": "Enumerated the two manifest paths containing {id}; inspected own_invoice's tenant comparison and return. This count denotes available handler-body review, not a verified dispatch and object-loading chain.",
      "exclusions": ["Export handler unavailable.", "Identifier-to-invoice resolution is outside scope."]
    },
    {
      "surface": "available-source-files",
      "status": "exhaustive",
      "discovered": 2,
      "reviewed": 2,
      "method": "rg --files enumerated the fixture; read all lines of routes.json and handlers.py. This inventory covers files physically provided, not all declared route implementations.",
      "exclusions": []
    },
    {
      "surface": "authentication-and-dispatch-implementations",
      "status": "limited",
      "discovered": null,
      "reviewed": 0,
      "method": "Scenario explicitly excludes these implementations; no implementation inventory can be established from the fixture.",
      "exclusions": ["Authenticated principal accepted as an assumption only.", "No source search beyond the fixture."]
    }
  ],
  "categories": [
    {
      "id": "tenant-isolation",
      "name": "Tenant and owner isolation",
      "status": "limited",
      "summary": "own_invoice rejects tenant mismatch before returning the invoice, assuming the principal and supplied invoice tenant fields are authoritative. Export and object resolution cannot be assessed. Tenant equality alone does not establish any unspecified per-user ownership policy.",
      "evidence": [{"path": "handlers.py", "start_line": 4, "end_line": 7, "snippet": "def own_invoice(principal, invoice):\n    if invoice[\"tenant_id\"] != principal[\"tenant_id\"]:\n        raise PermissionError(\"forbidden\")\n    return invoice"}]
    },
    {
      "id": "server-authorization",
      "name": "Server-side authorization and parity",
      "status": "limited",
      "summary": "admin_summary checks the supplied principal role before returning. No frontend gates are provided to compare; authentication, dispatch, and export authorization remain unverified.",
      "evidence": [{"path": "handlers.py", "start_line": 10, "end_line": 13, "snippet": "def admin_summary(principal):\n    if principal[\"role\"] != \"admin\":\n        raise PermissionError(\"forbidden\")\n    return {\"ok\": True}"}]
    },
    {
      "id": "object-authorization",
      "name": "Object-level authorization and IDOR",
      "status": "limited",
      "summary": "Two declared routes accept an object identifier. The accessible invoice handler contains a tenant check, but the export handler is unavailable and identifier resolution is excluded. No verified IDOR finding was identified; absence of IDOR across the router cannot be established.",
      "evidence": [
        {"path": "routes.json", "start_line": 2, "snippet": "  \"GET /own-invoice/{id}\": \"handlers.py:own_invoice\","},
        {"path": "routes.json", "start_line": 4, "snippet": "  \"GET /exports/{id}\": \"restricted.py:export\""},
        {"path": "handlers.py", "start_line": 5, "end_line": 7, "snippet": "    if invoice[\"tenant_id\"] != principal[\"tenant_id\"]:\n        raise PermissionError(\"forbidden\")\n    return invoice"}
      ]
    },
    {
      "id": "secrets-defaults",
      "name": "Secrets and unsafe defaults",
      "status": "limited",
      "summary": "Read both provided files; neither contains credential material or startup defaults. The withheld implementation, external authentication, configuration, and history are unavailable to this source-only review. No credential finding is supported.",
      "evidence": []
    },
    {
      "id": "untrusted-input-xss",
      "name": "Untrusted input and XSS",
      "status": "limited",
      "summary": "Available code returns an invoice object or a constant dictionary without visible HTML, template, DOM, or code-execution sinks. Response serialization and rendering are outside scope, and export is withheld; no broader XSS conclusion is supported.",
      "evidence": [
        {"path": "handlers.py", "start_line": 7, "snippet": "    return invoice"},
        {"path": "handlers.py", "start_line": 13, "snippet": "    return {\"ok\": True}"}
      ]
    }
  ],
  "findings": [],
  "strengths": [
    {
      "title": "Invoice handler rejects cross-tenant input before returning",
      "description": "Within the visible handler, unequal invoice and principal tenant identifiers raise PermissionError before the invoice return. This is a static control observation conditional on trusted principal and invoice attributes; runtime dispatch and data loading were not verified.",
      "evidence": [{"path": "handlers.py", "start_line": 4, "end_line": 7, "snippet": "def own_invoice(principal, invoice):\n    if invoice[\"tenant_id\"] != principal[\"tenant_id\"]:\n        raise PermissionError(\"forbidden\")\n    return invoice"}]
    },
    {
      "title": "Admin summary enforces a role check in its handler",
      "description": "A supplied principal whose role is not admin triggers PermissionError before the summary return. Authenticity and integrity of that role are assumed, not verified.",
      "evidence": [{"path": "handlers.py", "start_line": 10, "end_line": 13, "snippet": "def admin_summary(principal):\n    if principal[\"role\"] != \"admin\":\n        raise PermissionError(\"forbidden\")\n    return {\"ok\": True}"}]
    }
  ],
  "recommendations": [],
  "limitations": [
    {
      "title": "One of three declared route handlers is withheld",
      "details": "restricted.py:export cannot be read. Coverage is limited, 3 discovered and 2 reviewed routes. Its authorization cannot be inferred from other handlers. Review the export implementation when it is supplied; all-routes-reviewed and router-wide no-IDOR claims are unsupported.",
      "affected_paths": ["routes.json", "restricted.py"]
    },
    {
      "title": "Authenticated principal and dispatch are assumptions",
      "details": "The scenario states that authenticated middleware supplies principal. Authentication and dispatch implementations are outside scope and their paths are unknown. Principal integrity, role provenance, identifier resolution, and invoice loading could not be traced. These missing links are limitations rather than findings.",
      "affected_paths": ["handlers.py", "routes.json"]
    },
    {
      "title": "Execution, validation, and rendering prohibited",
      "details": "Only source reading and assigned JSON/log writing were authorized. No application execution, network access, installation, CLI validation, rendering, or dynamic tests were attempted. This JSON has not been CLI validated. PDF and issue Markdown were not generated, and no PDF visual inspection or generated issue review occurred. Any later evaluator validation is separate and is not an auditor-performed check.",
      "affected_paths": ["handlers.py", "routes.json"]
    },
    {
      "title": "Dirty containing worktree and source-only snapshot",
      "details": "The containing repository is on main at the recorded revision with modified tracked files and an untracked evaluations/fixtures directory. Evidence refers to the current supplied fixture contents, not solely committed content. Git status also warned that the global ignore file could not be accessed. No history or external service review was performed, and no other evaluation outcomes or tests were read.",
      "affected_paths": ["handlers.py", "routes.json"]
    }
  ]
}
